Series Name,Bibliographic ID Label,Bibliographic ID,Other Identifier Type,Other Identifier,Title,Creator,Contributor,Genre,Publisher,Date Created,Date Issued,Abstract,Language,Physical Description,Related Item Label,Related Item URL,Topical Subject,Geographic Subject,Temporal Subject,Terms of Use,Table of Contents,Note Type,Note,Note Type,Note,Publish,Hidden,File,Label,Offset,Skip Transcoding,Absolute Location
FRONTLINE,,,video recording identifier,94600,Easy Money,,,,,,1997-06-10,Winkelman interview,,,,,,,,,,local,Original footage,general,,,,barcode94600.mkv,,,yes,nothing
NOVA,,,video recording identifier,129761,Warriors of the Amazon (Yanamano),,,Scenics / B-roll,,,1997-06-10,"Original footage of Yanamano people and their village. Footage includes people walking through the village, doing hair, preparing food, children dancing and playing with spears, and walking along a footpath.",,,,,Peoples of South America,,,,,local,Original footage,general,Scenics / B-roll,,,barcode129761.mov,,,yes,nothing
Ten O'Clock News,,,video recording identifier,130933,Ten O'Clock News,,,,,,1987-12-15,"Perennial, inveterate political candidates and disgraced pseudo-celebrities fight back and resurrect themselves, despite their failures and claims of retirement from public arena. Nixon, Hart, Rice, Biden…
 reporter: Kelly",,,,,"News and Current Events, Politics and Government, Social Issues",,,,,local,News Tape,general,,,,barcode130933.mov,,,yes,nothing
Ten O'Clock News,,,video recording identifier,295955,Ten O'Clock News,,,,,,1984-10-11,"Vice presidential candidates George Bush and Geraldine Ferraro debate in Philadelphia. Moderated by Sander Vanocur. Panelists John Mashek, Norma Quarles, Robert Boyd, Jack White. reel 1 .",,,,,,,,,,local,News Tape,general,,,,barcode295955.mkv,,,yes,nothing