Collection Name,Collection Description,Unit Name,Collection ID,Title,Date Issued,Creators,Alternative Titles,Translated Titles,Uniform Titles,Statement Of Responsibility,Date Created,Copyright Date,Abstract,Notes,Format,Resource Types,Contributors,Publishers,Genres,Subjects,Related Item Urls,Geographic Subjects,Temporal Subjects,Topical Subjects,Bibliographic Id,Languages,Terms Of Use,Tables Of Contents,Physical Description,Other Identifiers,Comments,File Label,File Title,Instantiation Label,Instantiation Id,Instantiation Streaming URL,Instantiation Duration,Instantiation Mime Type,Instantiation Audio Bitrate,Instantiation Audio Codec,Instantiation Video Bitrate,Instantiation Video Codec,Instantiation Width,File Checksum,File Checksum,File Size,File Duration,File Aspect Ratio,File Frame Size,File Format,File Date Digitized,File Caption Text,File Caption Type,File Other Id,File Comment
Bingo Parlor Antics,Awesomely awesome antics at the Bingo Parlor. You won't believe your eyes.,Default Unit,,,,,,,,,,,,,,,,,,,,,,,,,,,,,,,,,,,,,,,,,,,,,,,,,,,,
,,,,Marjorie flips tables,1996-10-11,,,,,,,,"Akosua Perbi is interviewed about the impact of raids and kidnappings, warfare as a source of enslavement in Ghana, slave markets in Ghana, slaves given as tributes, minor offences leading to enslavement, external enslavement vs internal enslavement, fear, suspicion and insecurity during the time of slavery, the role of guns and gunpowder, kidnappings in Ghana, songs telling the history of slavery, in Ghana no slave owner had the power of life and death over the slave unlike Atlantic slavery, Ghanans were unaware of the harsh treatment of slaves overseas.",,,,,,,,,,,,,,,,,,,,,nova1,,https://avalon.wgbh.org/hls/avalon/22807/barcode102444/barcode102444.mkv.mp4/master.m3u8,,,,,,,,,,,,,,,,,,
,,,,Freddie scores 5 cards,1997-03-01,,,,,,,,"Margaret Washington is interviewed about the change from indentured labor towards enslaved labor, Virginians' concerns about black and white servants, the earliest Africans in Virginia, the relationships between Europeans and Africans, Jemmy, the leader of the Stono Rebellion, the idea of freedom for Stono rebels, the impact of the Stono Rebellion and the rise of Africans' concern after the Stono Rebellion.",,,,,,,,,,,,,,,,,,,nova_ep_1_uncut.mp4,nova1,nova1,2,https://avalon.wgbh.org/hls/avalon/22807/barcode129761/barcode129761.mkv.mp4/master.m3u8,,,,,,,,,,,,,,,,,,
Bingo Parlor Antics II - Electric Boogaloo,Just when you thought you'd seen it all at the Bingo Hall... you ain't seen nothin yet!!,Default Unit,,,,,,,,,,,,,,,,,,,,,,,,,,,,,,,,,,,,,,,,,,,,,,,,,,,,
,,,,$100K Payoff,1996-09-03,,,,,,,,"Betty Wood is interviewed about blacks fighting in the American Revolution, blacks leaving the US with the British, Dunmore's Proclamation and the fear of slave rebellion, controlling slaves after Dunmore's Proclamation, the significance of Dunmore's Proclamation.",,,,,,,,,,,,,,,,,,,nova_ep_2_interview_outtakes.mp4,nova2,nova2,3,https://avalon.wgbh.org/hls/avalon/22807/barcode130933/barcode130933.mkv.mp4/master.m3u8,,,,,,,,,,,,,,,,,,
,,,,Orthopedic Shoes and Morphine,1996-09-06,,,,,,,,"Colin Powell is interviewed about the Declaration of Independence and how it applied to black people, the spirit of liberty, on blacks fighting during the Revolutionary War",,,,,,,,,,,,,,,,,,,nova_ep_2_interview_outtakes.mp4,nova2,nova2,4,https://avalon.wgbh.org/hls/avalon/22807/barcode159097/barcode159097.mkv.mp4/master.m3u8,,,,,,,,,,,,,,,,,,
Bingo Parlor Brawls,"Strap in, get ready. Bingo in yo face!!",Default Unit,,,,,,,,,,,,,,,,,,,,,,,,,,,,,,,,,,,,,,,,,,,,,,,,,,,,
,,,,Donna and Don to the Death,1996-12-12,,,,,,,,"Albert Raboteau is interviewed about 1793 and the hope brought by the American Revolution, Richard Allen's conversion experience, Christianity and self-worth, founding of the Free African Society, founding of the African Methodist Episcopal Church, the Yellow Fever epidemic in Philadelphia, Richard Allen's reaction to the American Colonization Society, white Christianity vs. black Christianity, Nat Turner's Rebellion, Denmark Vesey's Conspiracy, Gabriel's Rebellion, Jarena Lee's conversion, separation of families, slave preachers, free black preachers and abolition.",,,,,,,,,,,,,,,,,,,frontline.mp4,frontline,frontline,5,https://avalon.wgbh.org/hls/avalon/22807/barcode273402/barcode273402.mkv.mp4/master.m3u8,,,,,,,,,,,,,,,,,,
,,,,Saul Canes Connie,1996-12-14,,,,,,,,"Emma Lapsansky is interviewed about 1790 as a turning point for African Americans, opportunities in Philadelphia, the Yellow Fever epidemic, Richard Allen, the American Society of Free Persons of Color, Edward Clay cartoons, Pavel Svinin's portraits of African American life in Philadelphia, the 1830 National Negro Convention in Philadelphia, kidnapping of free people, changes from 1825 - 1840, unrest in cities, African Americans come together, Freedom's Journal, Nat Turner's Rebellion part of a bigger movement.",,,,,,,,,,,,,,,,,,,frontline_deleted_scenes_and_bloopers.mp4,frontline,frontline,6,https://avalon.wgbh.org/hls/avalon/22807/barcode90950/barcode90950.mkv.mp4/master.m3u8,,,,,,,,,,,,,,,,,,
